<xs:schema attributeFormDefault="unqualified" elementFormDefault="qualified" xmlns:xs="http://www.w3.org/2001/XMLSchema">
    <xs:element name="products">
        <xs:complexType>
            <xs:sequence>
                <xs:element name="product" maxOccurs="unbounded" minOccurs="0">
                    <xs:complexType>  
                        <xs:sequence>
                            <xs:element name="category" type="xs:string"/>
                            <xs:element name="name" type="xs:string"/>
                            <xs:element name="description" type="xs:string"/>
                            <xs:element name="quantity">
                                <xs:simpleType>
                                    <xs:restriction base="xs:integer">
                                        <xs:minInclusive value="0"/> <!-- Bigger than 0 --> 
                                    </xs:restriction>
                                </xs:simpleType>
                            </xs:element>
                            <xs:element name="unitPrice">
                                <xs:simpleType>
                                    <xs:restriction base="xs:decimal">
                                        <xs:minInclusive value="0.0"/> <!-- Bigger than 0.0 --> 
                                    </xs:restriction>
                                </xs:simpleType>
                            </xs:element>
                        </xs:sequence>
                        <xs:attribute name="code" use="required">
                        <!-- REGEX FOR CODE= \d{3}[-]\d{2} __ \d{3} three digits __ [-] match symbol __ \d{2} two digits--> 
                            <xs:simpleType>
                                <xs:restriction base="xs:string">
                                    <xs:pattern value="\d{3}[-]\d{2}"/>
                                </xs:restriction>
                            </xs:simpleType>
                        </xs:attribute>
                    </xs:complexType>
                </xs:element>
            </xs:sequence>
        </xs:complexType>
    </xs:element>  
</xs:schema> 
